<?xml version="1.0" encoding="UTF-8"?>
<xsd:schema xmlns:xsd="http://www.w3.org/2001/XMLSchema"
            xmlns="http://www.hr.com/employee"
            targetNamespace="http://www.hr.com/employee"
            elementFormDefault="qualified">
  <xsd:complexType name="employeeType">
    <xsd:choice>
      <xsd:element name="full_time" type="xsd:string"/>
      <xsd:element name="part_time" type="xsd:string"/>
    </xsd:choice>
  </xsd:complexType>
  <xsd:element name="employees">
    <xsd:complexType>
      <xsd:sequence>
        <xsd:element name="employee" maxOccurs="unbounded">
          <xsd:complexType>
            <xsd:sequence>
              <xsd:element name="full_name" type="xsd:string"/>
              <xsd:element name="contract" type="employeeType"/>
            </xsd:sequence>
          </xsd:complexType>
        </xsd:element>
      </xsd:sequence>
    </xsd:complexType>
  </xsd:element>
</xsd:schema>
